{
  "audit": {
    "all_stages_temporally_realized": true,
    "detached_operational_pattern": false,
    "direct_dependency_declared": true,
    "direct_successor_valid": true,
    "distinct_carriers": true,
    "edge_counterfactually_necessary": true,
    "edge_kind_valid": true,
    "failed_obligations": [],
    "forbidden_verdict_fields_absent": true,
    "no_alternative_temporal_parent": true,
    "no_storage_mediator": true,
    "not_replayable_archive": true,
    "order_step_valid": true,
    "ownership_interface_valid": true,
    "payload_components_complete": true,
    "payload_hashes_match": true,
    "predictive_step_valid": true,
    "progress_step_valid": true,
    "route_discipline_valid": true,
    "single_use_temporal_token": true,
    "source_and_target_support_valid": true,
    "source_event_is_last": true,
    "stage_adjacency": true,
    "stages_well_formed": true,
    "strict_record_step_valid": true,
    "target_event_is_first": true,
    "tick_step_valid": true
  },
  "certificate_id": "DS-POS-01",
  "checker": {
    "checked_at_phase": "CST-TT-04",
    "function": "audit_direct_successor",
    "module": "cst_tt.corridor",
    "python_version": "3.13.5"
  },
  "claim_ceiling": "exact finite structural event-successor criterion only",
  "claim_lanes": [
    "S-L"
  ],
  "model_ref": "models/direct_successor/DS-POS-01.model.json",
  "model_sha256": "a3b5856d010b1fff44715225a44367e1417ef7021c038b7b5cc280f846d337f8",
  "result_status": "checked-finite-direct-temporal-successor",
  "schema_version": "CST-TT-04",
  "theorem_evidence": {
    "lean_compile_status": "pending-toolchain",
    "lean_declarations": [
      "CSTTT.DirectSuccessorTheory.directSuccessorValidity",
      "CSTTT.DirectSuccessorTheory.directSuccessorDetachedCopyExclusion",
      "CSTTT.DirectSuccessorTheory.directSuccessorPathComposition"
    ],
    "theorem_ids": [
      "TTD-01",
      "TTD-03"
    ]
  }
}
